{"aggregate_payload_sha256":"807a0f5052c50d9d86a229a43eb943e224cce03c40f068fe4d4ab2c146164b96","candidate_count":25,"cohort_id":"mnq-202609-5m-v1","cohort_outcome":"READY_FOR_SELECTION","contract_policy":{"candidate_date_end":"2026-07-24","candidate_date_start":"2026-06-22","contract_label":"MNQ SEP26","expiry_month":9,"expiry_year":2026,"full_name":"MNQ SEP26"},"eligible_count":23,"entries":[{"complete_session_source_sha256":"ed1f8c32161ce5702582532808715d4e0a5413e2838dae5e8d87a0adc107603b","eligible":true,"exclusion_reasons":[],"first_250_source_sha256":"0d35adcdc674acccbd80e0e584d0ea829664eb1aaf9344542138243e6ca8b560","observed_native_bar_count":276,"session_begin_application":"20260621 170000","session_end_application":"20260622 160000","trading_date":"2026-06-22"},{"complete_session_source_sha256":"f5784131d6840d1106ba01b932f35e0aedfc4ce254cac4c36397208f3066d8c7","eligible":true,"exclusion_reasons":[],"first_250_source_sha256":"c8cd3cd3938d0d712edbbec61d4b4de60dca3958298a90c1ae17c68a896efd18","observed_native_bar_count":276,"session_begin_application":"20260622 170000","session_end_application":"20260623 160000","trading_date":"2026-06-23"},{"complete_session_source_sha256":"c1443bb74f70a6f6b5162a81b9d9e40f64844645840e408f5bdd84153cba6b4d","eligible":true,"exclusion_reasons":[],"first_250_source_sha256":"c3fdcbaa4732cc2c2db14e34993cfbaa1174a0f84c7d30e55d6b38dafd17c392","observed_native_bar_count":276,"session_begin_application":"20260623 170000","session_end_application":"20260624 160000","trading_date":"2026-06-24"},{"complete_session_source_sha256":"bac0716dc29bca24f812ce3188615bd135a9c66b2f91515e67b609e700893f29","eligible":true,"exclusion_reasons":[],"first_250_source_sha256":"927034310e3e976d0a5d1a2cfc2195e73910e14d85e432c18233bf9289a4c17d","observed_native_bar_count":276,"session_begin_application":"20260624 170000","session_end_application":"20260625 160000","trading_date":"2026-06-25"},{"complete_session_source_sha256":"a7e0f062eab72c584f46ba1a8e61b2c3592618c2c9eea81a1fb22a72028935cd","eligible":true,"exclusion_reasons":[],"first_250_source_sha256":"8ccd77dd036c49dd49760aade5d02cf17a33c636a419285df9ddcf8dacdf89d2","observed_native_bar_count":276,"session_begin_application":"20260625 170000","session_end_application":"20260626 160000","trading_date":"2026-06-26"},{"complete_session_source_sha256":"b9596ee613cd899f58abadd965d6287c1e6340b5fefd7a911d155a5e726d34b7","eligible":true,"exclusion_reasons":[],"first_250_source_sha256":"2ba1c08dd801a8413b40bf725c6cb7264e89d9444a97cc05ae96587af81c0a1a","observed_native_bar_count":276,"session_begin_application":"20260628 170000","session_end_application":"20260629 160000","trading_date":"2026-06-29"},{"complete_session_source_sha256":"950ba14dc8d68f95a47c5226b555710c4de66e53c97a3a5db980b857c35c68e4","eligible":true,"exclusion_reasons":[],"first_250_source_sha256":"1cfb30d3bd73e49b35b2f38c8e49fc2673538b34f5483611606c73e573039aef","observed_native_bar_count":276,"session_begin_application":"20260629 170000","session_end_application":"20260630 160000","trading_date":"2026-06-30"},{"complete_session_source_sha256":"761dfd17adc87e9a13a1aa57291fd236514272d98afb9c7758c1be59b592c81e","eligible":true,"exclusion_reasons":[],"first_250_source_sha256":"b825791976aedaaca0135ee9206b30bb4776636515fa38747e6af36bdca61113","observed_native_bar_count":276,"session_begin_application":"20260630 170000","session_end_application":"20260701 160000","trading_date":"2026-07-01"},{"complete_session_source_sha256":"e5d6324663e2de024429239870d633ed58e0b40dca77c2f1d45e55fe27f75dd2","eligible":true,"exclusion_reasons":[],"first_250_source_sha256":"3583fddad843d4db8630ebb684d4b0419062c6066e401cf31b2e2ba83785a9bb","observed_native_bar_count":276,"session_begin_application":"20260701 170000","session_end_application":"20260702 160000","trading_date":"2026-07-02"},{"complete_session_source_sha256":"4e902c096eff69e8dca6990c8568db3552439751345c1854bcc63932a2e60c8f","eligible":false,"exclusion_reasons":["FEWER_THAN_250_NATIVE_BARS"],"first_250_source_sha256":null,"observed_native_bar_count":228,"session_begin_application":"20260702 170000","session_end_application":"20260703 120000","trading_date":"2026-07-03"},{"complete_session_source_sha256":"1daaea0eb6a61aa6e02fc52716ffb9108ef4a5220bbb0ca3577659ad8a823e57","eligible":true,"exclusion_reasons":[],"first_250_source_sha256":"5011d55730cce7e1a9b8efe680db320a184c3308a629a62bee858ce82cbe5fdb","observed_native_bar_count":276,"session_begin_application":"20260705 170000","session_end_application":"20260706 160000","trading_date":"2026-07-06"},{"complete_session_source_sha256":"6daa845e06f34b4cb99b478a26f6b50dcdb3b167804ccb17c2887d25b8fc4ee8","eligible":true,"exclusion_reasons":[],"first_250_source_sha256":"028174efc495e3ae56e46cef07692479ae5ede49a0b41c2262fd0e5731b251c6","observed_native_bar_count":276,"session_begin_application":"20260706 170000","session_end_application":"20260707 160000","trading_date":"2026-07-07"},{"complete_session_source_sha256":"486a79633d7e94ab0e08b559f3b201bce95b767e005dcaf122fea28f37d0df7a","eligible":true,"exclusion_reasons":[],"first_250_source_sha256":"3f70e7f1d8bf6f1bc73cb319595f94355f1eb079c0c8235a1685aec43ca34466","observed_native_bar_count":276,"session_begin_application":"20260707 170000","session_end_application":"20260708 160000","trading_date":"2026-07-08"},{"complete_session_source_sha256":"c7026eb438ae3c410d3032b2295eebd15aeba0526b146b052816cfd466d99d62","eligible":true,"exclusion_reasons":[],"first_250_source_sha256":"e334dd511fdad72992e54b9177258dbd9da4b5ed72b2e1a1ebd08753e6ca52d7","observed_native_bar_count":276,"session_begin_application":"20260708 170000","session_end_application":"20260709 160000","trading_date":"2026-07-09"},{"complete_session_source_sha256":"1d655b168c402ff42fc4a396a5e8d847edab47d9a29660f1c591b39f1ece597c","eligible":true,"exclusion_reasons":[],"first_250_source_sha256":"acbb10c3255cf4074685b2a2a258dafc27e13d9726d57f4f2b00980096b2841d","observed_native_bar_count":276,"session_begin_application":"20260709 170000","session_end_application":"20260710 160000","trading_date":"2026-07-10"},{"complete_session_source_sha256":"fa37735092026f04b129566ea4417b706c32663c7de319975c8ad8539ee8b25e","eligible":true,"exclusion_reasons":[],"first_250_source_sha256":"c72d2b005296a7c3e1f47650dacf0654bb58af702e9e7c4ceb4f90bccdc13796","observed_native_bar_count":276,"session_begin_application":"20260712 170000","session_end_application":"20260713 160000","trading_date":"2026-07-13"},{"complete_session_source_sha256":"027017423098cec7b88c19897fb958a70a69e94dc4153303309d88a31f976e08","eligible":true,"exclusion_reasons":[],"first_250_source_sha256":"7af9e5b3c745b8fde36bd5ecbd3a3ca049924ca681d1ec8957fbfce16f3f6f80","observed_native_bar_count":276,"session_begin_application":"20260713 170000","session_end_application":"20260714 160000","trading_date":"2026-07-14"},{"complete_session_source_sha256":"0fb2ec32bafee62d4612cc8c2d9d1e317ab4e9477c101f6ebd94ff84cb58f598","eligible":true,"exclusion_reasons":[],"first_250_source_sha256":"dc6aeee6b91b61e0c901a5e5bfa0178897ed21a359f9987fb9bfa3cdc53c0932","observed_native_bar_count":276,"session_begin_application":"20260714 170000","session_end_application":"20260715 160000","trading_date":"2026-07-15"},{"complete_session_source_sha256":"5c517b34ee97d767e34e3268b0c1f67149bb436b19680bd6eff6881327bb8b29","eligible":true,"exclusion_reasons":[],"first_250_source_sha256":"5279b1afe95b454391b28861c1e381aed7bd51ad8d3058dc063c77109697e2de","observed_native_bar_count":276,"session_begin_application":"20260715 170000","session_end_application":"20260716 160000","trading_date":"2026-07-16"},{"complete_session_source_sha256":"1d4c390de9c7c5e986b77951e859c85af102721e9f75773cfbb3c34da93286dc","eligible":true,"exclusion_reasons":[],"first_250_source_sha256":"036a66b3051d041c163b23e094eaf96f75aa93fdc3d4cb13c7c0fb62db008474","observed_native_bar_count":276,"session_begin_application":"20260716 170000","session_end_application":"20260717 160000","trading_date":"2026-07-17"},{"complete_session_source_sha256":"17cbe132ef5dcb9459622511d9281d84e969c9f31d98ae357124f6342cc409f2","eligible":true,"exclusion_reasons":[],"first_250_source_sha256":"aff4ed46da9aadb07a6be4465674885b02f20be75fa7626b81abc3dff09156b6","observed_native_bar_count":276,"session_begin_application":"20260719 170000","session_end_application":"20260720 160000","trading_date":"2026-07-20"},{"complete_session_source_sha256":"1a0ed73e90a2fdbf11e3e5e50561dab65e02bc8f5014eadbccd87d2121300230","eligible":true,"exclusion_reasons":[],"first_250_source_sha256":"481db001552aa381552468b573f430f257d20727eb11c26076ece4092bfa9613","observed_native_bar_count":276,"session_begin_application":"20260720 170000","session_end_application":"20260721 160000","trading_date":"2026-07-21"},{"complete_session_source_sha256":"fb1360cf00d710d91f9af56b99ba79a27972ee61b34875fc3c560be322f8ac98","eligible":true,"exclusion_reasons":[],"first_250_source_sha256":"fd4d770f2ae086c67c069b34b2be5b572d0879778f5a296b7986daf1101a6d7a","observed_native_bar_count":276,"session_begin_application":"20260721 170000","session_end_application":"20260722 160000","trading_date":"2026-07-22"},{"complete_session_source_sha256":"5f6d365c1af08900237d2075295e199ea26f310b4a5b39b21017455779494b41","eligible":true,"exclusion_reasons":[],"first_250_source_sha256":"f0bdc19a1ccd57387ec3b572e0bb83df428f69dda7a5872facf662a4ebb87582","observed_native_bar_count":276,"session_begin_application":"20260722 170000","session_end_application":"20260723 160000","trading_date":"2026-07-23"},{"complete_session_source_sha256":"be61e1291e8912e14f9e8c26593fd96e7c8aba4e4c468fc2c5f770ca84334db0","eligible":false,"exclusion_reasons":["FEWER_THAN_250_NATIVE_BARS","UNEXPECTED_MISSING_BARS"],"first_250_source_sha256":"46d9cdd6c847300379c1eb30e098e74917503ef40e5afb6a0234cdc092ca0554","observed_native_bar_count":266,"session_begin_application":"20260723 170000","session_end_application":"20260724 160000","trading_da